{
  "decision": "QUARANTINE_PENDING_ANALYSIS",
  "tenant_id": "00000000-0000-0000-0000-000000000001",
  "policy_profile_id": "00000000-0000-0000-0000-000000000101",
  "policy_snapshot_id": "00000000-0000-0000-0000-000000000201",
  "mode": "enforce",
  "feed_state": "fresh",
  "feed_snapshot_age_seconds": 12,
  "trace_id": "trace-quarantine",
  "rationale": ["unknown artifact"],
  "create_analysis_job": true
}